{
  "schemaVersion": "0.1",
  "generatorVersion": "0.1.0",
  "templateVersion": "0.1",
  "projectId": "PRJ-STANDARD-001",
  "projectRevision": 1,
  "modeRequested": "STANDARD",
  "packageStatus": "DRAFT",
  "createdAt": "2026-09-14T00:00:00Z",
  "files": [
    {
      "path": "project.json",
      "sha256": "d80fdb29f08d1bb5ad861caebe330a9c44aa27c782c70db9402c71123f2c11bb"
    }
  ],
  "capabilities": [
    "CORE"
  ],
  "gateResults": [
    {
      "id": "GATE-CORE",
      "status": "NOT_RUN",
      "rationale": "Contract fixture."
    }
  ],
  "knownLimitations": []
}